{
  "title": "İrem ve Uzay Macerası",
  "summary": "İrem Pamuk ile birlikte, Uzay Macerası dünyasında parçaları sabırla birleştirip haritayı yeniden parlattı.",
  "pages": [
    {
      "index": 1,
      "text": "Bir varmış bir yokmuş, yıldızların arasında süzülen küçük bir uzay gemisi varmış. İrem orada yaşarmış. Kahkahalar etrafa yayıldı. Herkesin yüzünde kocaman bir gülümseme vardı. Neşeyle zıplayarak ilerlediler. Gökyüzü yumuşak renklerle parlıyordu. İrem derin bir nefes aldı ve gülümsedi. Etraf tatlı seslerle doluydu. Uzaktan neşeli bir şarkı duyuluyordu. Birlikte olmak her şeyi kolaylaştırıyordu. O sırada İrem yeni bir ipucu fark etti; havada taze çiçek kokusu vardı. Biraz sonra Pamuk bir an durup sesleri dinledi; her şey biraz daha güzel görünüyordu.",
      "imagePrompt": "Uzay Macerası, açılış sahnesi, yumuşak pastel renkler, avatarlı kahraman ve Pamuk",
      "mood": "meraklı"
    },
    {
      "index": 2,
      "text": "Bir sabah İrem bir şey fark etti: gemi yolunu gösteren yıldız haritası kaybolmuştu. Pencereden bakınca bir takımyıldız onlara göz kırptı. Tam o anda İrem yolun nereye çıktığını merak etti; yerde renkli taşlar diziliydi. Bir süre sonra Pamuk arkadaşlarına güzel bir fikir anlattı; küçük kuşlar dallarda şakıyordu. Ardından İrem gülümseyerek el salladı; gökyüzü pembe ve turuncuya boyanmıştı. Yol boyunca Pamuk etrafına dikkatle baktı; bulutlar pamuk gibi süzülüyordu. Bir köşeyi dönünce İrem adımlarını yavaşlattı; yumuşak bir esinti saçlarını savuruyordu.",
      "imagePrompt": "Uzay Macerası, sahne 2, yumuşak pastel renkler, avatarlı kahraman ve Pamuk",
      "mood": "heyecanlı"
    },
    {
      "index": 3,
      "text": "İrem bir dileği olduğunu düşündü. \"Masalda bir ejderha dostum olsun\" diye fısıldadı ve dileği masalın içine karıştı. Kısa bir molada Pamuk cebindeki küçük defterine bir not aldı; uzaktan tatlı bir müzik geliyordu. O sırada İrem yeni bir ipucu fark etti; minik bir kelebek önlerinden geçti. Biraz sonra Pamuk bir an durup sesleri dinledi; her yer ışıl ışıl parlıyordu. Tam o anda İrem yolun nereye çıktığını merak etti; havada taze çiçek kokusu vardı.",
      "imagePrompt": "Uzay Macerası, sahne 3, yumuşak pastel renkler, avatarlı kahraman ve Pamuk",
      "mood": "heyecanlı"
    },
    {
      "index": 4,
      "text": "İrem Pamuk ile birlikte yola devam etti. Turuncu bir gezegende zıplayan taşlarla tanıştılar. Gemi küçük bir ayın yörüngesinde yavaşça döndü. Bir süre sonra Pamuk arkadaşlarına güzel bir fikir anlattı; her şey biraz daha güzel görünüyordu. Ardından İrem gülümseyerek el salladı; yerde renkli taşlar diziliydi. Yol boyunca Pamuk etrafına dikkatle baktı; küçük kuşlar dallarda şakıyordu. Bir köşeyi dönünce İrem adımlarını yavaşlattı; gökyüzü pembe ve turuncuya boyanmıştı. Kısa bir molada Pamuk cebindeki küçük defterine bir not aldı; bulutlar pamuk gibi süzülüyordu.",
      "imagePrompt": "Uzay Macerası, sahne 4, yumuşak pastel renkler, avatarlı kahraman ve Pamuk",
      "mood": "heyecanlı"
    },
    {
      "index": 5,
      "text": "İrem Pamuk ile birlikte yola devam etti. Kuyruklu bir yıldız onlara el sallayıp yanlarından geçti. O sırada İrem yeni bir ipucu fark etti; yumuşak bir esinti saçlarını savuruyordu. Biraz sonra Pamuk bir an durup sesleri dinledi; uzaktan tatlı bir müzik geliyordu. Tam o anda İrem yolun nereye çıktığını merak etti; minik bir kelebek önlerinden geçti. Bir süre sonra Pamuk arkadaşlarına güzel bir fikir anlattı; her yer ışıl ışıl parlıyordu. Ardından İrem gülümseyerek el salladı; havada taze çiçek kokusu vardı.",
      "imagePrompt": "Uzay Macerası, sahne 5, yumuşak pastel renkler, avatarlı kahraman ve Pamuk",
      "mood": "heyecanlı"
    },
    {
      "index": 6,
      "text": "İrem Pamuk ile birlikte yola devam etti. Ay'ın arka yüzünde haritanın parçalarını buldular. Yol boyunca Pamuk etrafına dikkatle baktı; her şey biraz daha güzel görünüyordu. Bir köşeyi dönünce İrem adımlarını yavaşlattı; yerde renkli taşlar diziliydi. Kısa bir molada Pamuk cebindeki küçük defterine bir not aldı; küçük kuşlar dallarda şakıyordu. O sırada İrem yeni bir ipucu fark etti; gökyüzü pembe ve turuncuya boyanmıştı. Biraz sonra Pamuk bir an durup sesleri dinledi; bulutlar pamuk gibi süzülüyordu.",
      "imagePrompt": "Uzay Macerası, sahne 6, yumuşak pastel renkler, avatarlı kahraman ve Pamuk",
      "mood": "heyecanlı"
    },
    {
      "index": 7,
      "text": "Sonunda İrem parçaları sabırla birleştirip haritayı yeniden parlattı. Tam o anda İrem yolun nereye çıktığını merak etti; yumuşak bir esinti saçlarını savuruyordu. Bir süre sonra Pamuk arkadaşlarına güzel bir fikir anlattı; uzaktan tatlı bir müzik geliyordu. Ardından İrem gülümseyerek el salladı; minik bir kelebek önlerinden geçti. Yol boyunca Pamuk etrafına dikkatle baktı; her yer ışıl ışıl parlıyordu. Bir köşeyi dönünce İrem adımlarını yavaşlattı; havada taze çiçek kokusu vardı. Kısa bir molada Pamuk cebindeki küçük defterine bir not aldı; her şey biraz daha güzel görünüyordu.",
      "imagePrompt": "Uzay Macerası, sahne 7, yumuşak pastel renkler, avatarlı kahraman ve Pamuk",
      "mood": "heyecanlı"
    },
    {
      "index": 8,
      "text": "Herkes çok mutluydu. İrem o gün yaptığı iyiliği hiç unutmadı. O sırada İrem yeni bir ipucu fark etti; yerde renkli taşlar diziliydi. Biraz sonra Pamuk bir an durup sesleri dinledi; küçük kuşlar dallarda şakıyordu. Tam o anda İrem yolun nereye çıktığını merak etti; gökyüzü pembe ve turuncuya boyanmıştı. Bir süre sonra Pamuk arkadaşlarına güzel bir fikir anlattı; bulutlar pamuk gibi süzülüyordu. Ardından İrem gülümseyerek el salladı; yumuşak bir esinti saçlarını savuruyordu.",
      "imagePrompt": "Uzay Macerası, kapanış sahnesi, yumuşak pastel renkler, avatarlı kahraman ve Pamuk",
      "mood": "mutlu"
    }
  ],
  "wordList": [
    {
      "word": "takımyıldız",
      "meaning": "Gökyüzünde bir şekil çizen yıldız grubu.",
      "page": 2
    },
    {
      "word": "yörünge",
      "meaning": "Bir gök cisminin etrafında dönülen yol.",
      "page": 4
    }
  ],
  "characters": [
    "İrem",
    "Pamuk"
  ],
  "endingType": "mutlu",
  "seriesUpdate": null,
  "refusal": null
}